[
  {
    "id": "r-index",
    "title": "English Study 导航",
    "type": "guide",
    "skill": "reading",
    "level": "A1",
    "source": "github:luckliu2007/English-study",
    "url": "https://github.com/luckliu2007/English-study/blob/main/docs/index.md",
    "summary": "仓库总导航，按技能与场景快速进入对应学习入口。",
    "body": "仓库总导航，按技能与场景快速进入对应学习入口。 本文来自 luckliu2007/English-study 仓库，作为应用内「阅读」材料随仓库同步更新。"
  },
  {
    "id": "r-learning-path",
    "title": "30 天学习路线",
    "type": "guide",
    "skill": "reading",
    "level": "A2",
    "source": "github:luckliu2007/English-study",
    "url": "https://github.com/luckliu2007/English-study/blob/main/docs/learning-path.md",
    "summary": "入门/中级/进阶三档 30 天计划，含每日时长与国内工具推荐。",
    "body": "入门/中级/进阶三档 30 天计划，含每日时长与国内工具推荐。 本文来自 luckliu2007/English-study 仓库，作为应用内「阅读」材料随仓库同步更新。"
  },
  {
    "id": "r-adaptive",
    "title": "自适应学习计划",
    "type": "guide",
    "skill": "reading",
    "level": "B1",
    "source": "github:luckliu2007/English-study",
    "url": "https://github.com/luckliu2007/English-study/blob/main/docs/adaptive-plan.md",
    "summary": "测评→分级→训练→复盘→调整的闭环，可生成每日 20–35 分钟任务。",
    "body": "测评→分级→训练→复盘→调整的闭环，可生成每日 20–35 分钟任务。 本文来自 luckliu2007/English-study 仓库，作为应用内「阅读」材料随仓库同步更新。"
  },
  {
    "id": "r-ai-english",
    "title": "用 AI 学英语",
    "type": "guide",
    "skill": "reading",
    "level": "B1",
    "source": "github:luckliu2007/English-study",
    "url": "https://github.com/luckliu2007/English-study/blob/main/docs/ai-english.md",
    "summary": "AI 口语陪练、写作批改与提示词库，把 AI 当低成本陪练。",
    "body": "AI 口语陪练、写作批改与提示词库，把 AI 当低成本陪练。 本文来自 luckliu2007/English-study 仓库，作为应用内「阅读」材料随仓库同步更新。"
  },
  {
    "id": "r-awesome",
    "title": "精选 GitHub 合集",
    "type": "guide",
    "skill": "reading",
    "level": "B2",
    "source": "github:luckliu2007/English-study",
    "url": "https://github.com/luckliu2007/English-study/blob/main/docs/awesome-lists.md",
    "summary": "高质量英语学习开源项目与词库合集。",
    "body": "高质量英语学习开源项目与词库合集。 本文来自 luckliu2007/English-study 仓库，作为应用内「阅读」材料随仓库同步更新。"
  },
  {
    "id": "r-github-projects",
    "title": "GitHub 项目精选",
    "type": "guide",
    "skill": "reading",
    "level": "B2",
    "source": "github:luckliu2007/English-study",
    "url": "https://github.com/luckliu2007/English-study/blob/main/docs/github-projects.md",
    "summary": "可直接用的开源英语学习项目、词汇库与程序员发音清单。",
    "body": "可直接用的开源英语学习项目、词汇库与程序员发音清单。 本文来自 luckliu2007/English-study 仓库，作为应用内「阅读」材料随仓库同步更新。"
  },
  {
    "id": "r-china-friendly",
    "title": "中国环境友好资源",
    "type": "guide",
    "skill": "reading",
    "level": "A2",
    "source": "github:luckliu2007/English-study",
    "url": "https://github.com/luckliu2007/English-study/blob/main/docs/china-friendly.md",
    "summary": "国内更稳定访问、可离线、适合通勤学习的资源。",
    "body": "国内更稳定访问、可离线、适合通勤学习的资源。 本文来自 luckliu2007/English-study 仓库，作为应用内「阅读」材料随仓库同步更新。"
  },
  {
    "id": "r-listening",
    "title": "听力",
    "type": "guide",
    "skill": "reading",
    "level": "A2",
    "source": "github:luckliu2007/English-study",
    "url": "https://github.com/luckliu2007/English-study/blob/main/docs/listening.md",
    "summary": "播客、慢速英语、真实语料输入方法与资源。",
    "body": "播客、慢速英语、真实语料输入方法与资源。 本文来自 luckliu2007/English-study 仓库，作为应用内「阅读」材料随仓库同步更新。"
  },
  {
    "id": "r-speaking",
    "title": "口语",
    "type": "guide",
    "skill": "reading",
    "level": "B1",
    "source": "github:luckliu2007/English-study",
    "url": "https://github.com/luckliu2007/English-study/blob/main/docs/speaking.md",
    "summary": "跟读、发音、影子训练与对话练习路径。",
    "body": "跟读、发音、影子训练与对话练习路径。 本文来自 luckliu2007/English-study 仓库，作为应用内「阅读」材料随仓库同步更新。"
  },
  {
    "id": "r-reading",
    "title": "阅读",
    "type": "guide",
    "skill": "reading",
    "level": "B1",
    "source": "github:luckliu2007/English-study",
    "url": "https://github.com/luckliu2007/English-study/blob/main/docs/reading.md",
    "summary": "分级读物、新闻与泛读材料，附精读/泛读方法。",
    "body": "分级读物、新闻与泛读材料，附精读/泛读方法。 本文来自 luckliu2007/English-study 仓库，作为应用内「阅读」材料随仓库同步更新。"
  },
  {
    "id": "r-writing",
    "title": "写作",
    "type": "guide",
    "skill": "reading",
    "level": "B1",
    "source": "github:luckliu2007/English-study",
    "url": "https://github.com/luckliu2007/English-study/blob/main/docs/writing.md",
    "summary": "语法检查、写作练习与学术/职场表达提升。",
    "body": "语法检查、写作练习与学术/职场表达提升。 本文来自 luckliu2007/English-study 仓库，作为应用内「阅读」材料随仓库同步更新。"
  },
  {
    "id": "r-vocab-grammar",
    "title": "词汇与语法",
    "type": "guide",
    "skill": "reading",
    "level": "A2",
    "source": "github:luckliu2007/English-study",
    "url": "https://github.com/luckliu2007/English-study/blob/main/docs/vocabulary-grammar.md",
    "summary": "单词、Anki、语法系统学习资源与背词建议。",
    "body": "单词、Anki、语法系统学习资源与背词建议。 本文来自 luckliu2007/English-study 仓库，作为应用内「阅读」材料随仓库同步更新。"
  },
  {
    "id": "r-exams",
    "title": "考试",
    "type": "guide",
    "skill": "reading",
    "level": "B2",
    "source": "github:luckliu2007/English-study",
    "url": "https://github.com/luckliu2007/English-study/blob/main/docs/exams.md",
    "summary": "IELTS、TOEFL、四六级与综合测试资源。",
    "body": "IELTS、TOEFL、四六级与综合测试资源。 本文来自 luckliu2007/English-study 仓库，作为应用内「阅读」材料随仓库同步更新。"
  },
  {
    "id": "r-developer",
    "title": "程序员英语",
    "type": "guide",
    "skill": "reading",
    "level": "B2",
    "source": "github:luckliu2007/English-study",
    "url": "https://github.com/luckliu2007/English-study/blob/main/docs/developer-english.md",
    "summary": "技术文档、开源协作与工程师职场英语。",
    "body": "技术文档、开源协作与工程师职场英语。 本文来自 luckliu2007/English-study 仓库，作为应用内「阅读」材料随仓库同步更新。"
  },
  {
    "id": "r-tools",
    "title": "工具",
    "type": "guide",
    "skill": "reading",
    "level": "A2",
    "source": "github:luckliu2007/English-study",
    "url": "https://github.com/luckliu2007/English-study/blob/main/docs/tools.md",
    "summary": "字典、字幕、浏览器插件与 AI 辅助工具清单。",
    "body": "字典、字幕、浏览器插件与 AI 辅助工具清单。 本文来自 luckliu2007/English-study 仓库，作为应用内「阅读」材料随仓库同步更新。"
  },
  {
    "id": "r-active-recall",
    "title": "主动回忆法",
    "type": "guide",
    "level": "B1",
    "skill": "reading",
    "source": "github:luckliu2007/English-study",
    "summary": "通过「从记忆中提取」而非反复阅读来强化记忆，是最高效的学习法之一。",
    "body": "主动回忆（active recall）指合上书本，凭记忆把内容写下来或说出来，再对照核对。研究一致表明，它比重复阅读更有效，因为提取动作本身会强化神经通路。用法：读完一节后用空白卡片自测、做完题先回想知识点、用费曼技巧复述。把它嵌入每天复习，长期记忆 retention 会明显提升。"
  },
  {
    "id": "r-feynman",
    "title": "费曼技巧",
    "type": "guide",
    "level": "B2",
    "skill": "reading",
    "source": "github:luckliu2007/English-study",
    "summary": "用「教给小白」的方式检验是否真懂，逼出知识盲区。",
    "body": "费曼技巧四步：① 选一个概念，假装在教一个外行；② 用最简单的话写下来，遇到卡壳就是盲区；③ 回看资料补齐盲区；④ 再简化类比。它能把「以为懂」变成「真懂」，特别适合语法、发音规则与学术概念。每周挑一个难点走一遍，理解深度会快速收敛。"
  },
  {
    "id": "r-pomodoro",
    "title": "番茄工作法",
    "type": "guide",
    "level": "A2",
    "skill": "reading",
    "source": "github:luckliu2007/English-study",
    "summary": "25 分钟专注 + 5 分钟休息的节奏，对抗拖延、保住注意力。",
    "body": "番茄工作法把学习切成 25 分钟一段（一个「番茄」），段间休息 5 分钟，每 4 段长休 15–30 分钟。它降低启动门槛、减少手机干扰，并让进度可见。配合每日 20–35 分钟的学习任务正好一个番茄，完成后打勾记录，坚持感和成就感会随之累积。"
  },
  {
    "id": "r-cornell-notes",
    "title": "康奈尔笔记法",
    "type": "guide",
    "level": "B1",
    "skill": "reading",
    "source": "github:luckliu2007/English-study",
    "summary": "一页三分栏：线索 / 笔记 / 总结，复习时遮住笔记自测。",
    "body": "康奈尔笔记把一页分为三区：右侧记要点，左侧写关键词/问题线索，底部写一句话总结。复习时遮住右侧，只看左侧线索回忆内容——本质仍是主动回忆。它结构清晰、便于考前速览，适合听课、读材料与看视频时同步使用。"
  },
  {
    "id": "r-interleaving",
    "title": "交错练习",
    "type": "guide",
    "level": "B2",
    "skill": "reading",
    "source": "github:luckliu2007/English-study",
    "summary": "混合不同题型/技能交替练，比长时间单刷一种更利于迁移。",
    "body": "交错练习（interleaving）指把相近技能打乱顺序练，例如听力、口语、语法轮换，而非连续两小时只练听力。虽当下更吃力，但长期迁移与辨别力更强。做法上，可以把当天的薄弱技能主动插进学习计划里轮换，天然形成交错。"
  },
  {
    "id": "r-metacognition",
    "title": "元认知",
    "type": "guide",
    "level": "C1",
    "skill": "reading",
    "source": "github:luckliu2007/English-study",
    "summary": "「对思考的思考」：计划—监控—复盘，让学习可被自己调控。",
    "body": "元认知是检视自己怎么学、学得怎样的能力，分三步：计划（我要达到什么、用什么策略）、监控（我走神了吗、这方法有效吗）、复盘（哪错、为什么、下次怎么改）。把每次练习的得分和各项反馈记录下来，对照目标调整下一步，就是在把元认知外显化。"
  },
  {
    "id": "r-study-group",
    "title": "学习小组",
    "type": "guide",
    "level": "B1",
    "skill": "reading",
    "source": "github:luckliu2007/English-study",
    "summary": "同伴讲解、互相纠错、责任共担，口语与坚持都更稳。",
    "body": "学习小组用「教别人」巩固自己，并在低风险环境练口语、互相纠错。3–5 人最佳，固定时间、带明确目标（如每周一个测验 + 一段 shadowing）。配合应用内学习路径，可把小组任务拆成每日可完成的微步骤，避免「组会变闲聊」。"
  },
  {
    "id": "r-exam-anxiety",
    "title": "考试焦虑应对",
    "type": "guide",
    "level": "B2",
    "skill": "reading",
    "source": "github:luckliu2007/English-study",
    "summary": "用模拟、呼吸与重构认知把焦虑降到「适度唤醒」区间。",
    "body": "考试焦虑源于不确定感与灾难化想象。对策：① 模拟考——按真实时长限时做，降低陌生感；② 盒式呼吸（4-4-4-4）在考前 1 分钟平复；③ 把「我会考砸」重构为「我已按计划练过，正常发挥即可」。每周做一次低压力的常态化模拟测验，也能显著降低临场紧张。"
  },
  {
    "id": "r-sla-evidence",
    "title": "英语学习的研究证据",
    "type": "guide",
    "level": "B1",
    "skill": "reading",
    "source": "github:luckliu2007/English-study",
    "summary": "要认识多少词才读得懂、泛读和纠错有没有用、看视频和 AI 对话能学到多少，附研究原文。",
    "body": "经典研究估计，阅读时认识约 98% 的词（每 50 个词最多 1 个生词）、听力约 95%，多数学习者才能不查词典读懂、听懂（2025 年的重复实验显示 90%–98% 之间差别不显著，宜当作经验线）；不查词典读小说、报纸需要 8,000–9,000 个词族。元分析显示：泛读明显好于只做精读；间隔复习有中到大的效果；先提示学习者自己改，比直接给出正确说法更有效；坚持并带反馈的发音训练效果大；教育类视频比娱乐类视频更有助于学习；AI 对话对口语有中等效果，但短期实验的效果最大，要定期脱离 AI 自测。"
  },
  {
    "id": "r-article-my-morning",
    "title": "My Morning",
    "type": "article",
    "skill": "reading",
    "level": "A1",
    "source": "English-study original",
    "summary": "用最简单的短句描述一个普通早晨的日常。",
    "body": "Every morning I wake up at seven o'clock. First, I open the window and look at the sky. Then I brush my teeth and wash my face. I eat bread and eggs for breakfast. I drink a cup of milk too. My sister makes tea. After breakfast, I put on my shoes and take my bag. I walk to the bus stop with my friend. The bus comes at eight. We talk and laugh on the bus. I like my mornings. They are simple and happy.",
    "wordCount": 86,
    "glossary": [
      {
        "word": "wake up",
        "meaning": "醒来，起床"
      },
      {